School Name,Address,State Name [Public School] Latest available year,Location ZIP [Public School] 2011-12,Location City [Public School] 2011-12
IN TECH ACADEMY AKA MS HS 368,"2975 Tibbett Ave, Bronx NY, 10463",New York,10463,BRONX
SOUTH BRONX PREPARATORY   A COLLEGE BOARD SCHOOL,"360 EAST 145 STREET, Bronx NY 10454",New York,10454,BRONX
"BRONX SCHOOL FOR LAW, GOVERNMENT AND JUSTICE","244 East 163rd Street, Bronx, NY 10451",New York,10451,BRONX
WEST BRONX ACADEMY FOR THE FUTURE,"500 East Fordham Road, Bronx, NY 10458",New York,10458,BRONX
URBAN ASSEMBLY SCHOOL FOR APPLIED MATH AND SCIENCE,"1595 Bathgate Avenue, Bronx, NY 10457",New York,10457,BRONX
EAST BRONX ACADEMY FOR THE FUTURE,"1716 Southern Boulevard, Bronx, NY 10460",New York,10460,BRONX
BRONX ACADEMY OF LETTERS,"339 Morris Avenue, Bronx, NY 10451",New York,10451,BRONX
INTERNATIONAL SCHOOL FOR LIBERAL ARTS,"2780 Reservoir Avenue, Bronx, NY 10468",New York,10468,BRONX
BRONX LATIN SCHOOL,"800 Home Street, Rm. 426; Bronx, NY 10456",New York,10456,BRONX
FREDERICK DOUGLAS ACADEMY III SECONDARY SCHOOL,"3630 3rd Ave, Bronx, NY 10456",New York,10456,BRONX
HIGH SCHOOL FOR TEACHING AND THE PROFESSIONS,"2780 Reservoir Avenue, Bronx, NY 10468",New York,10468,BRONX
SCHOOL FOR EXCELLENCE,"1110 BOSTON ROAD, BRONX, NY 10456",New York,10456,BRONX
ALFRED E SMITH CAREER AND TECHNICAL HIGH SCHOOL,"333 East 151st Street, Bronx, NY 10451",New York,10451,BRONX
METROPOLITAN HIGH SCHOOL,"1180 Rev James A Polite Avenue, Bronx, NY 10459",New York,10459,BRONX
BRONX COMMUNITY HIGH SCHOOL,"1980 Lafayette Avenue, Bronx, NY 10473",New York,10473,BRONX
PEACE AND DIVERSITY ACADEMY,"1180 Rev James A Polite Avenue, Bronx, NY 10459",New York,10459,BRONX
EXPLORATIONS ACADEMY,"1619 Boston Road, Bronx, NY 10460",New York,10460,BRONX
BRONX AEROSPACE HIGH SCHOOL,"800 EAST GUN HILL ROAD, Bronx NY 10467",New York,10467,BRONX
COLLEGIATE INSTITUTE FOR MATH AND SCIENCE,"925 Astor Avenue, Bronx, NY 10469",New York,10469,BRONX
BRONX HIGH SCHOOL OF BUSINESS,"240 East 172nd Street, Bronx, NY 10457",New York,10457,BRONX
BRONX LEADERSHIP ACADEMY HIGH SCHOOL,"1710 WEBSTER AVENUE , Bronx NY 10457",New York,10457,BRONX
LEADERSHIP INSTITUTE,"1701 FULTON AVENUE, Bronx NY 10457",New York,10457,BRONX
WOMEN S ACADEMY OF EXCELLENCE,"456 WHITE PLAINS ROAD, Bronx NY 10473",New York,10473,BRONX
NEW EXPLORERS HIGH SCHOOL,"730 CONCOURSE VILLAGE WEST, Bronx NY 10451",New York,10451,BRONX
EXIMIUS COLLEGE PREPARATORY ACADEMY,"1363 FULTON AVENUE, Bronx NY 10456",New York,10456,BRONX
BRONX ENGINEERING AND TECHNOLOGY ACADEMY,"99 TERRACE VIEW AVENUE, Bronx NY 10463",New York,10458,BRONX
HIGH SCHOOL OF COMPUTERS AND TECHNOLOGY,"800 EAST GUN HILL ROAD, Bronx NY 10467",New York,10467,BRONX
ASTOR COLLEGIATE ACADEMY,925 Astor Avenue  Bronx NY 10469,New York,10469,BRONX
COMMUNITY SCHOOL FOR SOCIAL JUSTICE,"350 Gerard Avenue, Bronx, NY 10451",New York,10451,BRONX
ACADEMY FOR LANGUAGE AND TECHNOLOGY,"1700 Macombs Road, Bronx, NY 10453",New York,10453,BRONX
INTERNATIONAL COMMUNITY HIGH SCHOOL,"345 Brook Avenue, Bronx NY",New York,10454,BRONX
MOTT HAVEN VILLAGE PREP HIGH SCHOOL,"701 Saint Anns Avenue, Bronx, NY 10455",New York,10455,BRONX
BRONX CENTER FOR SCIENCE AND MATHEMATICS,"1365 Fulton Avenue, Bronx, NY 10456",New York,10456,BRONX
BRONX INTERNATIONAL HIGH SCHOOL,"1110 BOSTON ROAD, BRONX, NY 10456",New York,10456,BRONX
MORRIS ACADEMY FOR COLLABORATIVE STUDIES,"1100 Boston Road, Bronx, NY 10456",New York,10456,BRONX
BRONX COLLEGIATE ACADEMY,"240 EAST 172 STREET, Bronx NY 10457",New York,10457,BRONX
DREAMYARD PREPARATORY SCHOOL,"240 East 172nd Street, Bronx, NY 10457",New York,10457,BRONX
MOTT HALL BRONX HIGH SCHOOL,"1595 Bathgate Avenue, Bronx, NY 10457",New York,10457,BRONX
VALIDUS PREPARATORY ACADEMY,"1595 Bathgate Avenue, Bronx, NY 10457",New York,10457,BRONX
BELMONT PREPERATORY HIGH SCHOOL,"500 East Fordham Road, Bronx, NY 10458",New York,10458,BRONX
BRONX HIGH SCHOOL LAW AND COMMUNITY SERVICES,"500 East Fordham Road, Bronx, NY 10458",New York,10458,BRONX
FORDHAM HIGH SCHOOL FOR THE ARTS,"500 East Fordham Road, Bronx, NY 10458",New York,10458,BRONX
FORDHAM LEADERSHIP ACADEMY FOR BUSINESS AND TECHNO,"500 East Fordham Road, Bronx, NY 10458",New York,10458,BRONX
KNOWLEDGE AND POWER PREP ACADEMY INTERNATIONAL HIG,"500 East Fordham Road, Bronx, NY 10458",New York,10458,BRONX
ARTURO SCHOMBURG SATELLITE ACADEMY BRONX,"1010 REV. J. A. POLITE AVENUE, Bronx NY 10459",New York,10459,BRONX
HOLCOMBE L RUCKER SCHOOL OF COMMUNITY RESEARCH,"965 Longwood, Bronx NY",New York,10459,BRONX
FANNIE LOU HAMER FREEDOM HIGH SCHOOL,"1021 JENNINGS STREET, Bronx NY 10460",New York,10460,BRONX
WINGS ACADEMY,"1122 EAST 180 STREET, Bronx NY 10460",New York,10460,BRONX
BRONX SCHOOL OF LAW AND FINANCE,"99 Terrace View Avenue, Bronx, NY 10463",New York,10463,BRONX
BRONX THEATRE HIGH SCHOOL,"99 Terrace View Avenue, Bronx, NY 10463",New York,10463,BRONX
ENGLISH LANGUAGE LEARNERS AND INTERNATIONAL SUPPOR,"99 Terrace View Avenue, Bronx, NY 10463",New York,10463,BRONX
MARBLE HILL HIGH SCHOOL OF INTERNATIONAL STUDIES,"99 TERRACE VIEW AVENUE, Bronx NY 10463",New York,10463,BRONX
NEW WORLD HIGH SCHOOL,"921 East 228th Street, Bronx, NY 10466",New York,10466,BRONX
DISCOVERY HIGH SCHOOL,"2780 Reservoir Avenue, Bronx, NY 10468",New York,10468,BRONX
KINGSBRIDGE INTERNATIONAL HIGH SCHOOL,"2780 Reservoir Avenue, Bronx, NY 10468",New York,10468,BRONX
THE CELIA CRUZ BRONX HIGH SCHOOL OF MUSIC,"2780 Reservoir Avenue, Bronx, NY 10468",New York,10468,BRONX
HIGH SCHOOL OF WORLD CULTURES,"1300 Boynton Avenue, Bronx, NY 10472",New York,10472,BRONX
PAN AMERICAN INTERNATIONAL HIGH SCHOOL AT MONROE,"1300 Boynton Avenue, Bronx, NY 10472",New York,10472,BRONX
FELISA RINCON DE GAUTIER INSTITUTE FOR LAW AND PUB,"1440 Story Avenue, Bronx, NY 10473",New York,10473,BRONX
PABLO NERUDA ACADEMY FOR ARCHITECTURE AND WORLD ST,"1980 Lafayette Avenue, Bronx, NY 10473",New York,10473,BRONX
HIGH SCHOOL FOR ENERGY AND TECHNOLOGY,"2474 CROTONA AVENUE, Bronx, NY 10458",New York,10458,Bronx
CROTONA INTERNATIONAL HIGH SCHOOL,"2474 CROTONA AVENUE, Bronx, NY 10458",New York,10458,Bronx
BRONX REGIONAL HS,"1010 REV. J. A. POLITE AVENUE, Bronx NY 10459",New York,10459,Bronx
NEW VISIONS CHARTER HIGH SCHOOL FOR HUMANITIES,"99 TERRACE VIEW AVENUE, Bronx NY 10463",New York,10463,Bronx
NEW VISIONS CHARTER HIGH SCHOOL FOR ADVANCED MATH AND SCIENCE,"99 TERRACE VIEW AVENUE, Bronx NY 10463",New York,10463,Bronx
Academy for Scholarship and Entrepreneurship: A College Board School,"921 East 228th Street, Bronx, NY 10466",New York,10466,Bronx
Bronx Academy for Software Engineering (BASE),"2474 CROTONA AVENUE, Bronx, NY 10458",New York,10458,Bronx
Bronx Design and Construction Academy,"333 East 151st Street, Bronx, NY 10451",New York,10451,Bronx
Bronx Engineering and Technology Academy,"99 Terrace View Ave, Bronx NY, 10463",New York,10463,Bronx
Bronxdale High School,"925 Astor Ave, Bronx NY 10469",New York,10469,Bronx
DEWITT CLINTON HIGH SCHOOL,"100 WEST MOSHOLU PARKWAY SOUTH, BRONX NY",New York,,BRONX
"Health, Education, and Research occupations High School (H.E.R.O)","455 Southern Blvd, Bronx NY 10455",New York,10455,Bronx
Bronx Compass High School,"1980 Lafayette Avenue, Bronx, NY 10473",New York,10473,Bronx
Comprehensive Model School Project,"580 Crotona Park South, Bronx, NY 10456",New York,10456,BRONX
Eagle Academy for Young Men,"4143 3rd Avenue, Bronx, NY 10457",New York,10457,Bronx
International Community High School,"345 Brook Avenue, Bronx, NY 10454",New York,10454,Bronx
Language and Innovation,"925 Astor Avenue, Bronx, NY 10469",New York,10469,Bronx
JUAN MOREL CAMPOS SECONDARY SCHOOL,"215 Heyward Street, Brooklyn, NY 11206",New York,11206,BROOKLYN
LYONS COMMUNITY SCHOOL,"223 Graham Avenue, Brooklyn, NY 11206",New York,11206,BROOKLYN
"SCIENCE, TECH AND RESEARCH HIGH SCHOOL AT ERASMUS",911 FLATBUSH AVENUE Brooklyn NY 11226,New York,11226,BROOKLYN
BROOKLYN COLLEGIATE A COLLEGE BOARD SCHOOL,"2021 Bergen Street, Brooklyn, NY 11233",New York,11233,BROOKLYN
DR SUSAN S MCKINNEY SECONDARY SCHOOL OF THE ARTS,"101 Park Avenue, Brooklyn, NY, 11205",New York,11205,BROOKLYN
TEACHERS PREPERATORY HIGH SCHOOL," 226 Bristol Street, Brooklyn, NY 11212",New York,11212,BROOKLYN
EAST NEW YORK FAMILY ACADEMY,2057 LINDEN BOULEVARD; Brooklyn NY 11207,New York,11207,BROOKLYN
SCHOOL FOR HUMAN RIGHTS,"600 Kingston Ave, Brooklyn, NY 11203",New York,11203,BROOKLYN
ALL CITY LEADERSHIP SECONDARY SCHOOL,"321 PALMETTO STREET, Brooklyn, NY 11237",New York,11237,BROOKLYN
BROOKLYN SCHOOL FOR GLOBAL STUDIES,"284 Baltic Street, Brooklyn, NY 11201",New York,11201,BROOKLYN
SCHOOL FOR DEMOCRACY AND LEADERSHIP,"600 Kingston Avenue, Brooklyn, NY 11203",New York,11203,BROOKLYN
PARK SLOPE COLLEGIATE,"237 7th Avenue, Brooklyn, NY 11215",New York,11215,BROOKLYN
FRANKLIN DELANO ROOSEVELT HIGH SCHOOL,"5800 20th Ave, Brooklyn, NY 11204",New York,11204,BROOKLYN
CLARA BARTON HIGH SCHOOL,"901 Classon Avenue, Brooklyn, NY 11225",New York,11225,BROOKLYN
SECONDARY SCHOOL FOR LAW,"237 7 AVENUE, Brooklyn, NY 11215",New York,11215,BROOKLYN
SECONDARY SCHOOL FOR JOURNALISM,"237 7th Ave, Brooklyn, NY 11215",New York,11215,BROOKLYN
W H MAXWELL CAREER AND TECHNICAL EDUCATION HIGH SC,"145 Pennsylvania Avenue, Brooklyn,  New York 11207  ",New York,11207,BROOKLYN
BROOKLYN BRIDGE ACADEMY,"6565 FLATLANDS AVENUE, Brooklyn NY 11236",New York,11236,BROOKLYN
FREDERICK DOUGLAS ACADEMY VII HIGH SCHOOL,"226 Bristol Street, Brooklyn, NY 11212",New York,11212,BROOKLYN
BUSHWICK LEADERS HS FOR ACADEMIC EXCELLENCE,"797 Bushwick Ave, Brooklyn NY 11221",New York,11221,BROOKLYN
WILLIAM E GRADY CAREER AND TECHNICAL EDUCATION HIG,"25 BRIGHTON 4TH ROAD, Brooklyn NY 11235",New York,11235,BROOKLYN
BUSHWICK SCHOOL FOR SOCIAL JUSTICE,"400 IRVING AVENUE, Brooklyn NY 11237",New York,11237,BROOKLYN
COBBLE HILL SCHOOL OF AMERICAN STUDIES,"347 BALTIC STREET, Brooklyn NY 11201",New York,11201,BROOKLYN
THE URBAN ASSEMBLY SCHOOL OF MUSIC AND ART AT WATE,"49 FLATBUSH AVENUE EXTENSION, Brookly NY 11201",New York,11201,BROOKLYN
IT TAKES A VILLAGE ACADEMY,"5800 TILDEN AVENUE, Brooklyn NY 11203",New York,11203,BROOKLYN
FOUNDATIONS ACADEMY,"70 TOMPKINS AVENUE, Brooklyn NY 11206",New York,11206,BROOKLYN
TRANSIT TECH CAREER AND TECHNICAL EDUCATION HIGH S,"1 Wells St, Brooklyn NY, 11208",New York,11208,BROOKLYN
EBC HIGH SCHOOL FOR PUBLIC SERVICE BUSHWICK,"1155 DEKALB AVENUE, Brooklyn NY 11221",New York,11221,BROOKLYN
HIGH SCHOOL FOR YOUTH AND COMMUNITY DEVELOPMENT,"911 FLATBUSH AVENUE, Brooklyn NY 11226",New York,11226,BROOKLYN
HS FOR PUBLIC SERVICE HEROES OF TOMORROW,"600 Kingston Avenue, Brooklyn, NY 11203",New York,11203,BROOKLYN
MULTICULTURAL HIGH SCHOOL,"999 Jamaica Avenue, Brooklyn, NY 11208",New York,11208,BROOKLYN
BROOKLYN PREPARATORY HIGH SCHOOL,"257 North 6th Street, Brooklyn, NY 11211",New York,11211,BROOKLYN
PROGRESS HIGH SCHOOL FOR PROFESSIONAL CAREERS,"850 Grand Street, Brooklyn, NY 11211",New York,11211,BROOKLYN
SCHOOL FOR LEGAL STUDIES,"850 Grand Street, Brooklyn, NY 11211",New York,11211,BROOKLYN
WILLIAMSBURG PREPARATORY SCHOOL,"257 North 6th Street, Brooklyn, NY 11211",New York,11211,BROOKLYN
METROPOLITAN DIPLOMA PLUS HIGH SCHOOL,"985 Rockaway Avenue, Brooklyn, NY 11212",New York,11212,BROOKLYN
HIGH SCHOOL OF SPORTS MANAGEMENT,"2630 Benson Avenue, Brooklyn, NY 11214",New York,11214,BROOKLYN
LIFE ACADEMY HIGH SCHOOL FOR FILM AND MUSIC,"2630 Benson Avenue, Brooklyn, NY 11214",New York,11214,BROOKLYN
FRANCES PERKINS ACADEMY,"50 Bedford Avenue, Brooklyn, NY 11222",New York,11222,BROOKLYN
W E B DUBOIS ACADEMIC HIGH SCHOOL,"402 Eastern Parkway, Brooklyn, NY 11225",New York,11225,BROOKLYN
SOUTH BROOKLYN COMMUNITY HIGH SCHOOL,"173 Conover Street, Brooklyn, NY 11231",New York,11231,BROOKLYN
OLYMPUS ACADEMY,"755 East 100th Street, Brooklyn, NY 11236",New York,11236,BROOKLYN
ACORN COMMUNITY HIGH SCHOOL,"561 Grand Avenue, Brooklyn, NY 11238",New York,11238,BROOKLYN
"The HIGH SCHOOL FOR ENTERPRISE, BUSINESS AND TECHNOLOGY","850 Grand Street, Brooklyn, NY 11211",New York,11211,BROOKLYN
ACADEMY FOR HEALTH CAREERS,"150 ALBANY AVE, BROOKLYN, NY 11213",New York,11213,BROOKLYN
Academy of Hospitality and Tourism,"911 FLATBUSH AVENUE, Brooklyn NY 11226",New York,11226,BROOKLYN
Automotive High School,"50 Bedford Avenue, Brooklyn, NY 11222",New York,11222,BROOKLYN
Boys and Girls High School,"1700 Fulton Street, Brooklyn, NY 11213",New York,11213,BROOKLYN
Brooklyn School for Music and Theatrer,"883 Classon Ave, Brooklyn NY 11225",New York,11225,BROOKLYN
Brooklyn Theatre Arts High School,"6565 FLATLANDS AVENUE, Brooklyn NY 11236",New York,11236,BROOKLYN
FDNY High School for Fire and Life Safey,"400 Pennsylvania Ave, Brooklyn NY 11207",New York,11207,BROOKLYN
HIGH SCHOOL FOR INNOVATION IN ADVERTISING AND MEDIA,"1600 Rockaway Parkway, Brooklyn NY 11236",New York,11236,BROOKLYN
JOHN DEWEY HIGH SCHOOL,"50 Avenue X, Brooklyn NY 11223",New York,11223,BROOKLYN
Pathways in Technology Early College High School          (P-Tech),"150 Albany Avenue, Brooklyn, NY 11213",New York,11213,BROOKLYN
School for International Studies,"284 Baltic Street, Brooklyn, NY 11201",New York,11201,BROOKLYN
"Science Skills Center High School for Science, Technology and the Creative Arts",49 FLATBUSH AVENUE EXTENSION Brooklyn NY 11201,New York,11201,BROOKLYN
The Brooklyn Academy for Global Finance,"125 Stuyvesant Avenue, Brooklyn, NY 11221",New York,11221,BROOKLYN
Urban Action Academy,"1600 Rockaway Parkway, Brooklyn, NY 11236",New York,11236,BROOKLYN
William E. Grady Career and Technical Education High School,"25 Brighton 4th Road, Brooklyn, NY 11235",New York,11235,BROOKLYN
Williamsburg High School for Architecture and Design,"257 North 6th Street, Brooklyn, NY 11211",New York,11211,BROOKLYN
World Academy for Total Community Health High School (WATCH),"400 PENNSYLVANIA AVENUE, Brooklyn, NY 11207",New York,11207,BROOKLYN
Aspirations Diploma Plus High School,"1495 HERKIMER STREET, Brooklyn NY 11233",New York,11233,BROOKLYN
Brooklyn Community Arts and Media High School,"300 Willoughby Avenue, Brooklyn, NY 11205",New York,11205,BROOKLYN
Brooklyn Leadership (transfer school),"300 Willoughby Avenue, Brooklyn, NY 11205",New York,11205,BROOKLYN
Cultural Academy for the Arts and Sciences,"5800 Tilden Avenue, Brooklyn, NY 11203",New York,11203,BROOKLYN
High School of Telecommunication Arts and Technology,"350 67th Street, Brooklyn, NY 11220",New York,11220,BROOKLYN
School for Classics,"370 Fountain Avenue, Brooklyn, NY 11208",New York,11208,BROOKLYN
Urban Assembly School for Law and Justice,"283 Adams Street, Brooklyn, NY 11201",New York,11201,BROOKLYN
Victory Collegiate High School,"6565 Flatlands Avenue, Brooklyn, NY 11236",New York,11236,BROOKLYN
Young Women's Leadership School of Brooklyn,"325 Bushwick Avenue, Brooklyn, NY 11206",New York,11206,BROOKLYN
Expeditionary Learning School for Community Leaders,"2630 Benson Avenue, Brooklyn, NY 11214",New York,11214,BROOKLYN
FREDERICK DOUGLASS ACADEMY,"2581 Adam Clayton Powell Junior Boulevard, New York, NY 10039",Manhattan,10039,MANHATTAN
CITY COLLEGE ACADEMY OF THE ARTS,"4600 Broadway, New York, NY 10040",Manhattan,10040,MANHATTAN
WASHINGTON HEIGHTS EXPEDITIONARY LEARNING SCHOOL,"511 West 182nd Street, New York, NY 10033",Manhattan,10033,MANHATTAN
EAST SIDE COMMUNITY SCHOOL,"420 East 12th Street, New York, NY 10009",Manhattan,10009,MANHATTAN
THURGOOD MARSHALL ACADEMY FOR LEARNING AND SOCIAL,"200-214 WEST 135TH STREET; Manhattan, NY 10030",Manhattan,10030,MANHATTAN
LIFE SCIENCES SECONDARY SCHOOL,"320 E 96th St, New York, NY 10128",New York,10128,MANHATTAN
A PHILIP RANDOLPH CAMPUS HIGH SCHOOL,"443 W 135th St, New York, NY 10031",Manhattan,10031,MANHATTAN
HIGH SCHOOL FOR LAW AND PUBLIC SERVICE,"549 Audubon Ave, New York, NY 10040",Manhattan,10040,MANHATTAN
HIGH SCHOOL FOR INTERNATIONAL BUSINESS AND FINANCE,"549 AUDUBON AVENUE, Manhattan NY 10040",Manhattan,10040,MANHATTAN
MARTA VALLE HIGH SCHOOL,"145 STANTON STREET, Manhattan NY 10002",Manhattan,10002,MANHATTAN
URBAN ASSEMBLY FOR THE PERFORMING ARTS,"509 West 129th Street, New York, NY 10027",Manhattan,10027,MANHATTAN
UNIVERSITY NEIGHBORHOOD HIGH SCHOOL,"200 MONROE STREET, Manhattan NY 10002",Manhattan,10002,MANHATTAN
UNITY CENTER FOR URBAN TECHNOLOGIES,"111 EAST 33RD STREET, Manhattan NY 10016",Manhattan,10016,MANHATTAN
CENTRAL PARK EAST HIGH SCHOOL,"1573 MADISON AVENUE, Manhattan NY 10029",Manhattan,10029,MANHATTAN
MANHATTAN CENTER FOR SCIENCE AND MATH,"260 PLEASANT AVENUE, Manhattan NY 10029",Manhattan,10029,MANHATTAN
JACQUELINE KENNEDY ONASSIS HIGH SCHOOL,"120 WEST 46 STREET, Manhattan NY 10026",Manhattan,10036,MANHATTAN
EMMA LAZARUS HIGH SCHOOL,"100 HESTER STREET, Manhattan NY 10002",Manhattan,10002,MANHATTAN
NEW DESIGN HIGH SCHOOL,"350 GRAND STREET, Manhattan NY 10002",Manhattan,10002,MANHATTAN
URBAN ASSEMBLY ACADEMY OF GOVERNMENT AND LAW,"350 Grand Street, New York, NY 10002",Manhattan,10002,MANHATTAN
HARVEY MILK HIGH SCHOOL,"2 Astor Place #3, New York, NY 10003",Manhattan,10003,MANHATTAN
URBAN ASSEMBLY SCHOOL OF BUSINESS FOR YOUNG WOMEN,"26 Broadway, New York, NY 10004",Manhattan,10004,MANHATTAN
LEADERSHIP AND PUBLIC SERVICE HIGH SCHOOL,"90 Trinity Place, New York, NY 10006",Manhattan,10006,MANHATTAN
LANDMARK HIGH SCHOOL,"351 West 18th Street, New York, NY 10011",Manhattan,10011,MANHATTAN
CHELSEA CAREER AND TECHNICAL EDUCATION HIGH SCHOOL,"131 Avenue of the Americas, New York, NY 10013",Manhattan,10013,MANHATTAN
FACING HISTORY SCHOOL,"525 West 50th Street, New York, NY 10019",Manhattan,10019,MANHATTAN
FOOD AND FINANCE HIGH SCHOOL,"525 West 50th Street, New York, NY 10019",Manhattan,10019,MANHATTAN
MANHATTAN BRIDGES HIGH SCHOOL,"525 West 50th Street, New York, NY 10019",Manhattan,10019,MANHATTAN
URBAN ASSEMBLY SCHOOL OF DESIGN AND CONSTRUCTION,"525 West 50th Street, New York, NY 10019",Manhattan,10019,MANHATTAN
VANGUARD HIGH SCHOOL,"317 East 67th Street, New York, NY 10065",Manhattan,10021,MANHATTAN
HIGH SCHOOL OF ARTS AND TECHNOLOGY,"122 Amsterdam Avenue, New York, NY 10023",Manhattan,10023,MANHATTAN
MOTT HALL HIGH SCHOOL,"6 EDGECOMBE AVENUE, Manhattan NY 10030",Manhattan,10030,MANHATTAN
GREGORIO LUPERON HIGH SCH FOR SCIENCE AND MATHEMAT,"501 West 165th Street, New York, NY 10032",Manhattan,10032,MANHATTAN
COALITION SCHOOL FOR SOCIAL CHANGE,"2351 1st Avenue, New York, NY 10035",Manhattan,10035,MANHATTAN
HIGH SCHOOL OF HOSPITALITY MANAGEMENT,"525 WEST 50TH STREET, Manhattan NY 10019",New York,10019,MANHATTAN
MURRAY HILL ACADEMY,"111 EAST 33RD STREET, Manhattan NY 10016",New York,10016,MANHATTAN
MANHATTAN ACADEMY FOR ARTS & LANGUAGE,"111 EAST 33RD STREET, Manhattan NY 10016",New York,10016,MANHATTAN
LOWER EAST SIDE PREPARATORY HIGH SCHOOL,"145 STANTON STREET, Manhattan NY 10002",New York,10002,MANHATTAN
WADLEIGH SECONDARY SCHOOL FOR THE PERFORMING AND VISUAL ARTS,"215 West 114 St, Manhattan NY 10026",New York,10026,MANHATTAN
Business of Sports School,"439 West 49th St, Manhattan NY 10019",New York,10019,MANHATTAN
"High School for Arts, Imagination and Inquiry","122 Amsterdam Avenue, New York, NY 10023",New York,10023,MANHATTAN
HIGH SCHOOL FOR HEALTH PROFESSIONS AND HUMAN SERVICES,345 East 15th Sst Manhattan NY 10003,New York,10003,MANHATTAN
HIGH SCHOOL OF ECONOMICS AND FINANCE,"100 Trinity Place, Manhattan NY 10006",New York,10006,MANHATTAN
The High School of Fashion Industries,"225 West 25th St, Manhattan NY 10011",New York,10011,MANHATTAN
MANHATTAN BUSINESS ACADEMY,"351 West 18th Street, New York, NY 10011",New York,10011,MANHATTAN
MANHATTAN EARLY COLLEGE SCHOOL FOR ADVERTISING,"411 Pearl, Manhattan NY 10038",New York,10038,MANHATTAN
Stephen Mather  for Building Arts and Craftsmanship High School,"439 WEST 49TH STREET, Manhattan, NY 10019",New York,10019,MANHATTAN
Union Square Academy for Health Sciences,"40 Irving Place, New York, NY 10003",New York,10003,MANHATTAN
Urban Assembly Gateway School for Technology,"439 West 49th Street, New York, NY 10019",New York,10019,MANHATTAN
Urban Assembly School for Emergency Management,"411 PEARL STREET, Manhattan, NY 10038",New York,10038,ManHATTAN
Urban Assembly School for Global Commerce,"2005 Madison Avenue, New York, NY 10035",New York,10035,MANHATTAN
Urban Assembly School for Green Careers,"145 West 84th Street, New York, NY 10024",New York,10024,MANHATTAN
47 American Sign Language and English Secondary School,"225 East 23rd Street, New York, NY 10010",New York,10010,MANHATTAN
Edward A. Reynolds West Side HS,"140 West 102nd Street, New York, NY 10025",New York,10025,MANHATTAN
Renaissance Charter High School for Innovation,"410 EAST 100 STREET, Manhattan NY 10029",New York,10029,Manhattan
EAST WEST SCHOOL OF INTERNATIONAL STUDIES,"46-21 Colden Street, Flushing, NY 11355",New York,11355,Queens
QUEENS COLLEGIATE   A COLLEGE BOARD SCHOOL,"167-01 GOTHIC DRIVE; Jamaica, NY 11432",New York,11432,Queens
HIGH SCHOOL FOR ARTS AND BUSINESS,"105-25 HORACE HARDING EXPY N, Queens NY 11368",New York,11368,Queens
HILLCREST HIGH SCHOOL,"160-05 HIGHLAND AVENUE, Queens NY 11432",New York,11432,Queens
INFORMATION TECHNOLOGY HIGH SCHOOL,"21-16 44th Road, Long Island City, NY 11101",New York,11101,Queens
JOHN ADAMS HIGH SCHOOL,"101-01 ROCKAWAY BOULEVARD, Queens, NY 11417",New York,11417,Queens
"HIGH SCH CONSTRUCTION, TRADES, ENGINEERING AND ARC","94-06 104TH STREET, Queens NY 11416",New York,11416,Queens
ACADEMY OF FINANCE AND ENTERPRISE,"30-20 Thomson Avenue, Long Island City, NY 11101",New York,11101,Queens
AVIATION CAREER AND TECHNICAL HIGH SCHOOL,"45-30 36th Street, Long Island City, NY 11101",New York,11101,Queens
INTERNATIONAL HIGH SCHOOL AT LAGUARDIA COMMUNITY C,"45-35 Van Dam Street, Long Island City, NY 11101",New York,11101,Queens
NEWCOMERS HIGH SCHOOL,"2801 41st Avenue, Long Island City, NY 11101",New York,11101,Queens
FLUSHING INTERNATIONAL HIGH SCHOOL,"144-80 Barclay Avenue, Flushing, NY 11355",New York,11355,Queens
PAN AMERICAN INTERNATIONAL HIGH SCHOOL,"45-10 94th Street, Elmhurst, NY 11373",New York,11373,Queens
QUEENS SATELLITE HIGH SCHOOL FOR OPPORTUNITY,"162-02 HILLSIDE AVENUE, Queens NY 11432",New York,11432,Queens
YOUNG WOMEN'S LEADERSHIP SCHOOL,"23-15 NEWTOWN AVENUE, Queens NY 11102",New York,11102,Queens
Energy Tech High School,"36-41 28 St, Queens NY 11106",New York,11106,Queens
Francis Lewis High School,"58-20 Utopia Parkway, Queens NY 11365",New York,11365,Queens
George Washington Carver High School for the Science,"143-10 Sprinfield Blvd, Queens NY 11413",New York,11413,Queens
INSTITUTE FOR HEALTH PROFESSIONS AT CAMBRIA HEIGHTS,"207- 01 116TH AVENUE, Queens NY 11411",New York,11411,Queens
INTERNATIONAL HIGH SCHOOL FOR HEALTH SCIENCES,"48-01 90 St, Queens NY 11373",New York,11373,Queens
LONG ISLAND CITY HIGH SCHOOL,"14-30 Broadway, Queens NY 11106",New York,11106,Queens
"Queens High School for Information, Research & Technology (QIRT)","8-21 Bay 25th Street, Far Rockaway, NY 11691",New York,11691,Queens
Richmond Hill High School,"89-30 114th Street, Richmond Hill, NY 11418",New York,11418,Queens
Thomas Edison Career and Technical Education High School,"165-65 84th Avenue, Jamaica, NY 11432",New York,11432,Queens
Cambria Heights Academy,"188-4 91st Avenue, Hollis, NY 11423",New York,11423,Queens
Queens High School of Language Studies,"35-01 UNION STREET, Queens, NY 11354",New York,11354,Queens