School Name,Address,Minutes from Grand Central Terminal,Minutes from Fulton Center,Minutes from MetroTech Center
47 The American Sign Language and English Secondary School,"225 East 23rd Street, New York, NY 10010",9,22,31
A. PHILIP RANDOLPH CAMPUS HIGH SCHOOL,"433 W 135th St, New York, NY 10031",33,40,47
Academy for College Preparation and Career Exploration: A College Board School,"911 FLATBUSH AVE, BROOKLYN NY 11213",47,36,29
ACADEMY FOR CONSERVATION AND THE ENVIRONMENT,6565 Flatlands Avenue Brooklyn NY 11235,60,55,48
ACADEMY FOR ENVIRONMENTAL LEADERSHIP,"400 IRVING AVE, BROOKLYN NY 10453",28,32,47
ACADEMY FOR HEALTH CAREERS,"150 ALBANY AVE, BROOKLYN, NY 11213",47,32,29
ACADEMY FOR LANGUAGE AND TECHNOLOGY,"1700 Macombs Road, Bronx, NY 10453",35,50,65
Academy for Scholarship and Entrepreneurship: A College Board School,"921 East 228th Street, Bronx, NY 10466",68,77,86
ACADEMY FOR SOCIAL ACTION: A COLLEGE BOARD SCHOOL,"509 WEST 129TH ST, NEW YORK NY 11208",58,77,87
ACADEMY FOR YOUNG WRITERS,"1065 ELTON ST, BROOKLYN NY 10029",62,53,50
ACADEMY OF FINANCE AND ENTERPRISE,"30-20 Thomson Avenue, Long Island City, NY 11101",18,37,38
Academy of Hospitality and Tourism,"911 FLATBUSH AVENUE, Brooklyn NY 11226",45,39,25
Academy of Innovative Technology,"999 Jamaica Avenue, Brooklyn, NY 11208",50,45,39
ACADEMY OF MEDICAL TECHNOLOGY: A COLLEGE BOARD SCHOOL,"8 21 BAY 25TH ST, FAR ROCKAWAY NY 11691",67,56,53
ACADEMY OF URBAN PLANNING,"400 IRVING AVE, BROOKLYN NY 11237",28,32,47
Achievement First Brooklyn High School,"1485 Pacific Street, Brooklyn NY 11216",41,22,19
Achievement First Brooklyn University Prep High School,"1485 Pacific Street, Brooklyn NY 11216",41,22,19
ACORN COMMUNITY HIGH SCHOOL,"561 Grand Avenue, Brooklyn, NY 11238",44,27,18
Alfred E. Smith Career and Technical Education High School,"333 East 151st Street, Bronx, NY 10451",28,43,58
ALL CITY LEADERSHIP SECONDARY SCHOOL,"321 PALMETTO STREET, Brooklyn, NY 11237",33,46,31
Antonia Pantoja Preparatory Academy: A College Board School,"1980 LAFAYETTE AVE, BRONX NY 11237",56,63,79
"ARCHIMEDES ACADEMY FOR MATH, SCIENCE AND TECHNOLOGY APPLICATIONS","456 WHITE PLAINS RD, BRONX NY 11237",56,69,86
ARTURO A. SCHOMBURG SATELLITE ACADEMY BRONX,"1010 REV. J. A. POLITE AVENUE, Bronx NY 10459",38,53,62
Aspirations Diploma Plus High School,"1495 HERKIMER STREET, Brooklyn NY 11233",39,27,24
ASTOR COLLEGIATE ACADEMY,925 Astor Avenue  Bronx NY 10469,59,69,79
Automotive High School,"50 Bedford Avenue, Brooklyn, NY 11222",25,32,31
AVIATION CAREER AND TECHNICAL HIGH SCHOOL,"45-30 36th Street, Long Island City, NY 11101",16,41,51
BANANA KELLY HIGH SCHOOL,"965 LONGWOOD AVE, BRONX NY 10473",29,38,53
BAYSIDE HIGH SCHOOL,"32-24 CORPORAL KENNEDY ST, QUEENS NY 11361",67,78,84
BEDFORD STUYVESANT PREPARATORY HIGH SCHOOL,"832 MARCY AVE, BROOKLYN NY 11233",34,25,25
BELMONT PREPARATORY HIGH SCHOOL,"500 East Fordham Road, Bronx, NY 10458",26,47,63
Boys and Girls High School,"1700 Fulton Street, Brooklyn, NY 11213",38,19,16
Bronx Academy for Software Engineering (BASE),"2474 CROTONA AVENUE, Bronx, NY 10458",55,69,77
BRONX ACADEMY OF HEALTH CAREERS,"800 EAST GUN HILL RD, BRONX NY 10467",47,57,73
BRONX AEROSPACE HIGH SCHOOL,"800 EAST GUN HILL ROAD, Bronx NY 10467",62,69,79
BRONX ARENA HIGH SCHOOL,"1440 STORY AVE, BRONX NY 10457",42,52,68
BRONX BRIDGES HIGH SCHOOL,"1980 LAFAYETTE AVE, BRONX NY 10459",56,63,79
BRONX CAREER AND COLLEGE PREPARATORY HIGH SCHOOL,"800 HOME ST, BRONX NY 10457",36,46,62
BRONX CENTER FOR SCIENCE AND MATHEMATICS,"1365 Fulton Avenue, Bronx, NY 10456",55,73,74
BRONX COLLABORATIVE HIGH SCHOOL,"100 WEST MOSHOLU PARKWAY SOUTH, BRONX NY",40,55,70
BRONX COLLEGIATE ACADEMY,"240 EAST 172 STREET, Bronx NY 10457",35,51,49
BRONX COMMUNITY HIGH SCHOOL,"1980 Lafayette Avenue, Bronx, NY 10473",58,75,86
Bronx Compass High School,"1980 Lafayette Avenue, Bronx, NY 10473",58,75,86
Bronx Design and Construction Academy,"333 East 151st Street, Bronx, NY 10451",28,43,58
BRONX EARLY COLLEGE ACADEMY FOR TEACHING AND LEARNING,"250 EAST 164TH ST, BRONX NY 10459",29,39,54
BRONX ENGINEERING AND TECHNOLOGY ACADEMY,"99 TERRACE VIEW AVENUE, Bronx NY 10463",28,62,57
BRONX ENVISION ACADEMY,"1619 BOSTON RD, BRONX NY 11236",33,43,58
BRONX GUILD,"1980 Lafayette Avenue, Bronx, NY 10473",58,75,86
BRONX HAVEN HIGH SCHOOL,"333 EAST 151ST ST, BRONX NY 10451",23,33,51
BRONX HEALTH SCIENCES HIGH SCHOOL,"750 BAYCHESTER AVE, BRONX NY 10460",64,62,74
BRONX HIGH SCHOOL FOR LAW AND COMMUNITY SERVICES,"500 East Fordham Road, Bronx, NY 10458",26,47,63
BRONX HIGH SCHOOL FOR MEDICAL SCIENCE,"240 EAST 172ND ST, BRONX NY 11225",29,39,46
BRONX HIGH SCHOOL FOR WRITING AND COMMUNICATION ARTS,"800 EAST GUN HILL RD, BRONX NY 11233",47,57,73
BRONX HIGH SCHOOL OF BUSINESS,"240 East 172nd Street, Bronx, NY 10457",35,51,49
BRONX INTERNATIONAL HIGH SCHOOL,"1110 BOSTON ROAD, BRONX, NY 10456",46,68,68
BRONX LAB SCHOOL,"800 EAST GUN HILL RD, BRONX NY 11203",47,57,73
BRONX LATIN SCHOOL,"800 Home Street, Rm. 426; Bronx, NY 10456",49,59,69
BRONX LEADERSHIP ACADEMY HIGH SCHOOL,"1710 WEBSTER AVENUE , Bronx NY 10457",41,56,61
BRONX LEADERSHIP ACADEMY II HIGH SCHOOL,"730 CONCOURSE VILLAGE WEST, BRONX NY 11201",22,32,47
BRONX LIGHTHOUSE CHARTER SCHOOL,"1001 INTERVALE AVE, BRONX NY 10459",26,36,51
BRONX PREPARATORY CHARTER SCHOOL,"3872 3RD AVE, BRONX NY 10457",43,56,62
BRONX REGIONAL HIGH SCHOOL,"1010 REV. J. A. POLITE AVENUE, Bronx NY 10459",38,53,62
BRONX RIVER HIGH SCHOOL,"3000 East Tremont Avenue, Bronx NY 10461",45,59,70
"BRONX SCHOOL FOR LAW, GOVERNMENT AND JUSTICE","244 East 163rd Street, Bronx, NY 10451",32,47,53
BRONX SCHOOL OF LAW AND FINANCE,"99 Terrace View Avenue, Bronx, NY 10463",28,62,57
BRONX STUDIO SCHOOL FOR WRITERS AND ARTISTS,"928 SIMPSON ST, BRONX NY 11208",31,45,57
BRONX THEATRE HIGH SCHOOL,"99 Terrace View Avenue, Bronx, NY 10463",28,62,57
Bronxdale High School,"925 Astor Ave, Bronx NY 10469",59,69,79
BROOKLYN ACADEMY HIGH SCHOOL,"832 MARCY AVE, BROOKLYN NY 11212",34,25,25
BROOKLYN ACADEMY OF SCIENCE AND THE ENVIRONMENT,"883 CLASSON AVE, BROOKLYN NY 11212",29,22,18
BROOKLYN BRIDGE ACADEMY,"6565 FLATLANDS AVENUE, Brooklyn NY 11236",65,54,47
BROOKLYN COLLEGIATE: A COLLEGE BOARD SCHOOL,"2021 Bergen Street, Brooklyn, NY 11233",49,30,27
"Brooklyn Community High School of Communication, Arts and Media","300 Willoughby Avenue, Brooklyn, NY 11205",39,30,15
BROOKLYN FRONTIERS HIGH SCHOOL,"112 SCHERMERHORN ST, BROOKLYN NY 11221",21,12,9
BROOKLYN GENERATION SCHOOL,"6565 FLATLANDS AVE, BROOKLYN NY 10002",60,55,48
Brooklyn High School for Law and Technology,"1396 BROADWAY, Brooklyn NY 11221",34,27,31
BROOKLYN HIGH SCHOOL FOR LEADERSHIP AND COMMUNITY SERVICE,"300 WILLOUGHBY AVE, BROOKLYN NY 11694",32,23,19
BROOKLYN HIGH SCHOOL OF THE ARTS,"345 Dean Street, Brooklyn NY 11217",24,16,10
BROOKLYN INSTITUTE FOR LIBERAL ARTS,"600 KINGSTON AVE, BROOKLYN NY 10033",40,29,30
Brooklyn International High School,"49 Flatbush Avenue Extension, Brooklyn, NY 11201",30,17,7
BROOKLYN LAB SCHOOL,"999 JAMAICA AVE, BROOKLYN NY 10451",47,43,33
BROOKLYN PREPARATORY HIGH SCHOOL,"257 North 6th Street, Brooklyn, NY 11211",21,28,32
BROOKLYN SCHOOL FOR GLOBAL STUDIES,"284 Baltic Street, Brooklyn, NY 11201",33,19,11
BROOKLYN SCHOOL FOR MATH AND RESEARCH,"400 IRVING AVE, BROOKLYN NY 10452",28,32,47
Brooklyn School for Music and Theatrer,"883 Classon Ave, Brooklyn NY 11225",34,21,19
BROOKLYN STUDIO SECONDARY SCHOOL,"8310 21st Avenue, Brooklyn NY 11214",54,44,41
Brooklyn Theatre Arts High School,"6565 FLATLANDS AVENUE, Brooklyn NY 11236",65,54,47
BROOME STREET ACADEMY CHARTER HIGH SCHOOL,"121 AVENUE OF THE AMERICAS, Manhattan NY 10013",19,10,17
BROWNSVILLE ACADEMY HIGH SCHOOL,"1150 EAST NEW YORK AVE, BROOKLYN NY 11203",37,27,27
BUSHWICK COMMUNITY HIGH SCHOOL,"231 PALMETTO ST, BROOKLYN NY 11208",31,35,47
BUSHWICK LEADERS HIGH SCHOOL FOR ACADEMIC EXCELLENCE,"797 Bushwick Ave, Brooklyn NY 11221",35,31,28
BUSHWICK SCHOOL FOR SOCIAL JUSTICE,"400 IRVING AVENUE, Brooklyn NY 11237",34,47,32
Business of Sports School,"439 West 49th St, Manhattan NY 10019",15,23,30
Cambria Heights Academy,"188-4 91st Avenue, Hollis, NY 11423",51,68,67
CASCADES HIGH SCHOOL,"198 FORSYTH ST3RD FL, NEW YORK NY 10030",29,40,46
CENTRAL PARK EAST HIGH SCHOOL,"1573 MADISON AVENUE, Manhattan NY 10029",18,39,49
CHANNEL VIEW SCHOOL FOR RESEARCH,"10000 BEACH CHANNEL DR, ROCKAWAY PARK NY 10468",65,55,51
CHELSEA CAREER AND TECHNICAL EDUCATION HIGH SCHOOL,"131 Avenue of the Americas, New York, NY 10013",19,10,17
CITY COLLEGE ACADEMY OF THE ARTS,"4600 Broadway, New York, NY 10040",48,49,56
"City Polytechnic High School of Engineering, Architecture, and Technology","105 Tech Place, Brooklyn, NY 11201",25,12,2
CIVIC LEADERSHIP ACADEMY,"4510 94TH ST, ELMHURST NY 10460",34,46,59
CLARA BARTON HIGH SCHOOL,"901 Classon Avenue, Brooklyn, NY 11225",35,21,18
Claremont International High School,"240 East 172nd Street, Bronx, NY 10457",35,51,49
COALITION SCHOOL FOR SOCIAL CHANGE,"2351 1st Avenue, New York, NY 10035",26,46,56
COBBLE HILL SCHOOL OF AMERICAN STUDIES,"347 BALTIC STREET, Brooklyn NY 11201",26,21,14
COLLEGIATE INSTITUTE FOR MATH AND SCIENCE,"925 Astor Avenue, Bronx, NY 10469",59,69,79
COMMUNITY HEALTH ACADEMY OF THE HEIGHTS,"504 WEST 158th ST, NEW YORK NY 11207",39,42,49
COMMUNITY SCHOOL FOR SOCIAL JUSTICE,"350 Gerard Avenue, Bronx, NY 10451",22,37,53
Comprehensive Model School Project,"580 Crotona Park South, Bronx, NY 10456",56,73,73
Cristo Rey New York High School,"112 East 106th Street, New York, NY 10029",15,29,46
CROTONA ACADEMY HIGH SCHOOL,"639 St. Anns Avenue, Bronx NY 10455",27,37,52
CROTONA INTERNATIONAL HIGH SCHOOL,"2474 CROTONA AVENUE, Bronx, NY 10458",55,69,77
Cultural Academy for the Arts and Sciences,"5800 Tilden Avenue, Brooklyn, NY 11203",60,45,45
CYPRESS HILLS COLLEGIATE PREPARATORY SCHOOL,"999 JAMAICA AVE, BROOKLYN NY 10009",47,43,33
DEWITT CLINTON HIGH SCHOOL,"100 WEST MOSHOLU PARKWAY SOUTH, BRONX NY",40,55,70
DISCOVERY HIGH SCHOOL,"2780 Reservoir Avenue, Bronx, NY 10468",39,54,69
DR. RICHARD IZQUIERDO HEALTH AND SCIENCE CHARTER SCHOOL,"800 HOME STREET, Bronx NY 10456",45,59,69
DR. SUSAN S. MCKINNEY SECONDARY SCHOOL OF THE ARTS,"101 Park Avenue, Brooklyn, NY, 11205",41,23,12
DREAMYARD PREPARATORY SCHOOL,"240 East 172nd Street, Bronx, NY 10457",35,51,49
Eagle Academy for Young Men,"4143 3rd Avenue, Bronx, NY 10457",57,46,61
EAGLE ACADEMY FOR YOUNG MEN II,"1137 HERKIMER ST, BROOKLYN NY 11355",41,26,23
EAST BRONX ACADEMY FOR THE FUTURE,"1716 Southern Boulevard, Bronx, NY 10460",34,52,61
EAST BROOKLYN COMMUNITY HIGH SCHOOL,"9517 KINGS HGWY, BROOKLYN NY 11221",38,46,30
EAST NEW YORK FAMILY ACADEMY,2057 LINDEN BOULEVARD; Brooklyn NY 11207,55,40,35
EAST SIDE COMMUNITY SCHOOL,"420 East 12th Street, New York, NY 10009",18,26,27
EAST WEST SCHOOL OF INTERNATIONAL STUDIES,"46-21 Colden Street, Flushing, NY 11355",48,77,73
EBC HIGH SCHOOL FOR PUBLIC SERVICE BUSHWICK,"1155 DEKALB AVENUE, Brooklyn NY 11221",34,29,29
Edward A. Reynolds West Side High School,"140 West 102nd Street, New York, NY 10025",41,39,45
EL PUENTE ACADEMY FOR PEACE AND JUSTICE,"250 HOOPER ST, BROOKLYN NY 10025",32,21,34
EMMA LAZARUS HIGH SCHOOL,"100 HESTER STREET, Manhattan NY 10002",19,18,18
Energy Tech High School,"36-41 28 St, Queens NY 11106",18,40,46
English Language Learners and International Support Preparatory Academy (ELLIS),"99 Terrace View Avenue, Bronx, NY 10463",28,62,57
ESPERANZA PREPARATORY ACADEMY,"240 EAST 109TH ST, MANHATTAN NY 10002",17,31,46
EXCELSIOR PREPARATORY HIGH SCHOOL,"143 10 SPRINGFIELD BLVD, SPRINGFIELD GARDENS NY 10463",65,56,55
EXIMIUS COLLEGE PREPARATORY ACADEMY,"1363 FULTON AVENUE, Bronx NY 10456",55,73,74
Expeditionary Learning School for Community Leaders,"2630 Benson Avenue, Brooklyn, NY 11214",63,51,49
EXPLORATIONS ACADEMY,"1619 Boston Road, Bronx, NY 10460",47,56,65
FACING HISTORY SCHOOL,"525 West 50th Street, New York, NY 10019",18,25,32
FANNIE LOU HAMER FREEDOM HIGH SCHOOL,"1021 JENNINGS STREET, Bronx NY 10460",36,56,67
FDNY High School for Fire and Life Safey,"400 Pennsylvania Ave, Brooklyn NY 11207",51,36,31
FELISA RINCON DE GAUTIER INSTITUTE FOR LAW AND PUBLIC POLICY,"1440 Story Avenue, Bronx, NY 10473",42,62,66
FLUSHING INTERNATIONAL HIGH SCHOOL,"144-80 Barclay Avenue, Flushing, NY 11355",46,73,69
FOOD AND FINANCE HIGH SCHOOL,"525 West 50th Street, New York, NY 10019",18,25,32
FORDHAM HIGH SCHOOL FOR THE ARTS,"500 East Fordham Road, Bronx, NY 10458",26,47,63
FORDHAM LEADERSHIP ACADEMY FOR BUSINESS AND TECHNOLOGY,"500 East Fordham Road, Bronx, NY 10458",26,47,63
FOREIGN LANGUAGE ACADEMY OF GLOBAL STUDIES,"470 JACKSON AVE, BRONX NY 11413",28,39,55
FORSYTH SATELLITE ACADEMY,"198 FORSYTH ST, NEW YORK NY 10460",17,13,12
FOUNDATIONS ACADEMY,"70 TOMPKINS AVENUE, Brooklyn NY 11206",36,32,18
FRANCES PERKINS ACADEMY,"50 Bedford Avenue, Brooklyn, NY 11222",25,32,31
Francis Lewis High School,"58-20 Utopia Parkway, Queens NY 11365",62,76,79
FRANKLIN DELANO ROOSEVELT HIGH SCHOOL,"5800 20th Ave, Brooklyn, NY 11204",49,50,40
FREDERICK DOUGLAS ACADEMY VII HIGH SCHOOL,"226 Bristol Street, Brooklyn, NY 11212",50,35,30
FREDERICK DOUGLASS ACADEMY II SECONDARY SCHOOL,"215 WEST 114TH ST, NEW YORK NY 11207",32,34,41
FREDERICK DOUGLASS ACADEMY III SECONDARY SCHOOL,"3630 3rd Ave, Bronx, NY 10456",51,69,65
FREDERICK DOUGLASS ACADEMY IV SECONDARY SCHOOL,"1010 LAFAYETTE AVE, BROOKLYN NY 10473",35,27,29
FREDERICK DOUGLASS ACADEMY VI SECONDARY SCHOOL,"8-21 Bay 25th Street, Far Rockaway, NY 11691",75,63,59
George Washington Carver High School for the Sciences,"143-10 Sprinfield Blvd, Queens NY 11413",78,66,72
George Westinghouse Career and Technical Education High School,"105 Johnson Street, Brooklyn, NY 11201",25,12,2
GOTHAM PROFESSIONAL ARTS ACADEMY,"265 RALPH AVE, BROOKLYN NY 10473",37,23,20
GREAT OAKS CHARTER SCHOOL,"1 Monroe St, Manhattan NY 10002",21,13,17
GREEN SCHOOL: AN ACADEMY FOR ENVIRONMENTAL CAREERS,"223 GRAHAM AVE, BROOKLYN NY 10455",21,24,31
Gregorio Luperon High School for Science and Mathematics,"501 West 165th Street, New York, NY 10032",45,40,47
GROVER CLEVELAND HIGH SCHOOL,"21-27 HIMROD STREET, Queens NY 11385",39,42,48
HARLEM CHILDREN'S ZONE PROMISE ACADEMY I CHARTER SCHOOL,"245 West 129th Street, Manhattan 10027, Manhattan NY 10027",33,39,45
HARLEM CHILDREN'S ZONE PROMISE ACADEMY II CHARTER SCHOOL,"35 East 125th Street, Manhattan 10035, Manhattan NY 10035",20,41,51
HARLEM RENAISSANCE HIGH SCHOOL,"22 EAST 128TH ST, NEW YORK NY 11206",18,27,46
Harlem Village Academies High School,"35 West 124th Street, Manhattan NY 10027",18,28,41
HARVEY MILK HIGH SCHOOL,"2 Astor Place #3, New York, NY 10003",9,14,20
HEALTH OPPORTUNITIES HIGH SCHOOL,"350 Gerard Avenue, Bronx, NY 10451",22,37,53
"Health, Education, and Research occupations High School (H.E.R.O)","455 Southern Blvd, Bronx NY 10455",26,47,57
HENRY STREET SCHOOL FOR INTERNATIONAL STUDIES,"220 HENRY ST, NEW YORK NY 10003",23,20,13
HERITAGE SCHOOL,"1680 LEXINGTON AVE, NEW YORK NY 10002",13,27,44
HIGH SCHOOL FOR ARTS AND BUSINESS,"105-25 HORACE HARDING EXPY N, Queens NY 11368",50,66,62
"High School for Arts, Imagination and Inquiry","122 Amsterdam Avenue, New York, NY 10023",27,31,37
HIGH SCHOOL FOR CIVIL RIGHTS,"400 PENNSYLVANIA AVE, BROOKLYN NY 11368",43,35,33
HIGH SCHOOL FOR COMMUNITY LEADERSHIP,"167 01 GOTHIC DR, JAMAICA NY 11207",40,50,60
HIGH SCHOOL FOR CONTEMPORARY ARTS,"800 EAST GUN HILL RD, BRONX NY 11211",47,57,73
HIGH SCHOOL FOR DUAL LANGUAGE AND ASIAN STUDIES,"350 GRAND ST, NEW YORK NY 10034",22,18,12
HIGH SCHOOL FOR ENERGY AND TECHNOLOGY,"2474 CROTONA AVENUE, Bronx, NY 10458",55,69,77
HIGH SCHOOL FOR ENVIRONMENTAL STUDIES,"444 WEST 56TH ST, NEW YORK NY 10040",18,30,38
HIGH SCHOOL FOR EXCELLENCE AND INNOVATION,"650 ACADEMY ST, NEW YORK NY 11236",50,50,50
High School for Global Citizenship,"883 Classon Avenue, Brooklyn, NY 11225",29,22,18
HIGH SCHOOL FOR HEALTH CAREERS AND SCIENCES,"549 AUDUBON AVE, NEW YORK NY 10469",41,49,60
HIGH SCHOOL FOR HEALTH PROFESSIONS AND HUMAN SERVICES,345 East 15th Sst Manhattan NY 10003,15,23,30
HIGH SCHOOL FOR INNOVATION IN ADVERTISING AND MEDIA,"1600 Rockaway Parkway, Brooklyn NY 11236",54,63,57
High School for Language and Diplomacy,"40 IRVING PLACE, Manhattan New York 10003",12,10,23
HIGH SCHOOL FOR LAW AND PUBLIC SERVICE,"549 Audubon Ave, New York, NY 10040",56,55,50
"High School for Law, Advocacy and Community Justice","122 AMSTERDAM AVE, NEW YORK NY 10468",19,23,34
HIGH SCHOOL FOR MEDIA AND COMMUNICATIONS,"549 AUDUBON AVE, NEW YORK NY 11226",41,49,60
HIGH SCHOOL FOR MEDICAL PROFESSIONS,"1600 ROCKAWAY PARKWAY, BROOKLYN NY 10023",49,48,45
HIGH SCHOOL FOR PUBLIC SERVICE: HEROES OF TOMORROW,"600 Kingston Avenue, Brooklyn, NY 11203",49,34,31
HIGH SCHOOL FOR SERVICE AND LEARNING AT ERASMUS,"911 FLATBUSH AVE, BROOKLYN NY 10467",47,36,29
HIGH SCHOOL FOR TEACHING AND THE PROFESSIONS,"2780 Reservoir Avenue, Bronx, NY 10468",39,54,69
HIGH SCHOOL FOR VIOLIN AND DANCE,"1100 BOSTON RD, BRONX NY 10006",39,51,66
High School for Youth and Community Development at Erasmus,"911 FLATBUSH AVENUE, Brooklyn NY 11226",45,39,25
HIGH SCHOOL OF APPLIED COMMUNICATION,"30-20 Thomson Avenue, Long Island City, NY 11101",18,37,38
HIGH SCHOOL OF ARTS AND TECHNOLOGY,"122 Amsterdam Avenue, New York, NY 10023",27,31,37
HIGH SCHOOL OF COMPUTERS AND TECHNOLOGY,"800 EAST GUN HILL ROAD, Bronx NY 10467",62,69,79
HIGH SCHOOL OF ECONOMICS AND FINANCE,"100 Trinity Place, Manhattan NY 10006",19,4,14
HIGH SCHOOL OF HOSPITALITY MANAGEMENT,"525 WEST 50TH STREET, Manhattan NY 10019",18,25,32
High School of Language and Innovation,"925 Astor Avenue, Bronx, NY 10469",59,69,79
HIGH SCHOOL OF SPORTS MANAGEMENT,"2630 Benson Avenue, Brooklyn, NY 11214",63,51,49
High School of Telecommunication Arts and Technology,"350 67th Street, Brooklyn, NY 11220",53,36,32
HIGH SCHOOL OF WORLD CULTURES,"1300 Boynton Avenue, Bronx, NY 10472",36,57,67
HILLCREST HIGH SCHOOL,"160-05 HIGHLAND AVENUE, Queens NY 11432",41,61,57
HOLCOMBE L. RUCKER SCHOOL OF COMMUNITY RESEARCH,"965 Longwood, Bronx NY",29,49,60
HOSTOS-LINCOLN ACADEMY OF SCIENCE,"600 ST ANN'S AVE, BRONX NY 11203",26,39,51
HYDE LEADERSHIP CHARTER SCHOOL,"830 Hunts Point Ave, BRONX NY 10474",35,49,66
INDEPENDENCE HIGH SCHOOL,"850 10TH AVE, NEW YORK NY 11214",34,25,17
INFORMATION TECHNOLOGY HIGH SCHOOL,"21-16 44th Road, Long Island City, NY 11101",13,27,36
INNOVATION DIPLOMA PLUS,"145 West 84 Street, Manhattan NY 10024",28,32,39
INSTITUTE FOR HEALTH PROFESSIONS AT CAMBRIA HEIGHTS,"207- 01 116TH AVENUE, Queens NY 11411",78,85,95
In-Tech Academy (M.S. / High School 368),"2975 Tibbett Ave, Bronx NY, 10463",32,64,59
INTERNATIONAL COMMUNITY HIGH SCHOOL,"345 Brook Avenue, Bronx, NY 10454",24,44,55
INTERNATIONAL HIGH SCHOOL AT LAFAYETTE,"2630 BENSON AVE, BROOKLYN NY 11101",58,54,46
International High School at LaGuardia Community College,"45-35 Van Dam Street, Long Island City, NY 11101",17,38,47
INTERNATIONAL HIGH SCHOOL AT PROSPECT HEIGHTS,"883 CLASSON AVE, BROOKLYN NY 10463",29,22,18
INTERNATIONAL HIGH SCHOOL AT UNION SQUARE,"40 IRVING PLACE, NEW YORK NY 11432",12,10,23
INTERNATIONAL HIGH SCHOOL FOR HEALTH SCIENCES,"48-01 90 St, Queens NY 11373",35,51,60
INTERNATIONAL LEADERSHIP CHARTER SCHOOL,"2900 EXTERIOR STSTE 1R, BRONX NY 10463",46,53,67
INTERNATIONAL SCHOOL FOR LIBERAL ARTS,"2780 Reservoir Avenue, Bronx, NY 10468",39,54,69
IT TAKES A VILLAGE ACADEMY,"5800 TILDEN AVENUE, Brooklyn NY 11203",60,45,45
JACQUELINE KENNEDY ONASSIS HIGH SCHOOL,"120 WEST 46 STREET, Manhattan NY 10026",8,22,25
JAMAICA GATEWAY TO THE SCIENCES,"16701 GOTHIC DR, JAMAICA NY 10463",42,51,61
JILL CHAIFETZ TRANSFER HIGH SCHOOL,"778 FOREST AVENUE, BRONX NY 10456",26,36,52
JOHN ADAMS HIGH SCHOOL,"101-01 ROCKAWAY BOULEVARD, Queens, NY 11417",56,44,40
JOHN DEWEY HIGH SCHOOL,"50 Avenue X, Brooklyn NY 11223",61,49,43
JOHN V. LINDSAY WILDCAT ACADEMY CHARTER SCHOOL,"1231 Lafayette Avenue, Bronx 10474, Manhattan NY 10474",34,55,71
JOHN W LAVELLE PREPARATORY CHARTER SCHOOL,"1 Teleport Drive, Staten Island, NY 10311",112,80,120
JUAN MOREL CAMPOS SECONDARY SCHOOL,"215 Heyward Street, Brooklyn, NY 11206",31,27,25
KHALIL GIBRAN INTERNATIONAL ACADEMY,"326 SCHERMERHORN ST, BROOKLYN NY 11214",22,13,11
KINGSBOROUGH EARLY COLLEGE SCHOOL,"2630 BENSON AVE, BROOKLYN NY 10006",58,54,46
KINGSBRIDGE INTERNATIONAL HIGH SCHOOL,"2780 Reservoir Avenue, Bronx, NY 10468",39,54,69
KIPP NYC College Prep,"201 East 144th Street, Bronx, NY 10451",19,28,44
Knowledge and Power Preparatory Academy International High School (Kappa),"500 East Fordham Road, Bronx, NY 10458",26,47,63
KURT HAHN EXPEDITIONARY LEARNING SCHOOL,"5800 TILDEN AVE, BROOKLYN NY 10002",56,45,41
LANDMARK HIGH SCHOOL,"351 West 18th Street, New York, NY 10011",24,16,22
LEADERSHIP AND PUBLIC SERVICE HIGH SCHOOL,"90 Trinity Place, New York, NY 10006",19,5,13
LEADERSHIP INSTITUTE,"1701 FULTON AVENUE, Bronx NY 10457",57,75,68
LIBERATION DIPLOMA PLUS,"2865 WEST 19TH ST, BROOKLYN NY 10023",64,55,48
LIBERTY HIGH SCHOOL ACADEMY FOR NEWCOMERS,"250 WEST 18TH ST, NEW YORK NY 11101",42,42,58
LIFE ACADEMY HIGH SCHOOL FOR FILM AND MUSIC,"2630 Benson Avenue, Brooklyn, NY 11214",63,51,49
LIFE SCIENCES SECONDARY SCHOOL,"320 E 96th St, New York, NY 10128",15,36,46
LONG ISLAND CITY HIGH SCHOOL,"14-30 Broadway, Queens NY 11106",31,47,47
LOWER EAST SIDE PREPARATORY HIGH SCHOOL,"145 STANTON STREET, Manhattan NY 10002",22,16,13
LOWER MANHATTAN ARTS ACADEMY,"350 GRAND ST, NEW YORK NY 10472",22,18,12
LYONS COMMUNITY SCHOOL,"223 Graham Avenue, Brooklyn, NY 11206",26,33,33
MANHATTAN ACADEMY FOR ARTS & LANGUAGE,"111 EAST 33RD STREET, Manhattan NY 10016",3,19,29
MANHATTAN BRIDGES HIGH SCHOOL,"525 West 50th Street, New York, NY 10019",18,25,32
MANHATTAN BUSINESS ACADEMY,"351 West 18th Street, New York, NY 10011",24,16,22
MANHATTAN CENTER FOR SCIENCE AND MATHEMATICS,"260 PLEASANT AVENUE, Manhattan NY 10029",25,45,55
MANHATTAN COMPREHENSIVE NIGHT AND DAY HIGH SCHOOL,"240 2ND AVE, NEW YORK NY 10472",64,78,98
Manhattan International High School,"317,E 67th St,New York,NY,10065-6051",12,25,35
MANHATTAN THEATRE LAB HIGH SCHOOL,"122 AMSTERDAM AVE, NEW YORK NY 10455",19,23,34
MANHATTAN VILLAGE ACADEMY,"43 WEST 22ND ST, NEW YORK NY 10016",11,17,20
MARBLE HILL HIGH SCHOOL FOR INTERNATIONAL STUDIES,"99 TERRACE VIEW AVENUE, Bronx NY 10463",28,62,57
MARTA VALLE HIGH SCHOOL,"145 STANTON STREET, Manhattan NY 10002",22,16,13
"Math, Engineering, and Science Academy Charter High School","231 Palmetto Street, Brooklyn 11221, BROOKLYN NY 11221",41,44,32
"Mathematics, Science Research and Technology Magnet High School","207-01 116th St, Queens NY 11411",71,83,87
METROPOLITAN DIPLOMA PLUS HIGH SCHOOL,"985 Rockaway Avenue, Brooklyn, NY 11212",50,38,33
METROPOLITAN HIGH SCHOOL,"1180 Rev James A Polite Avenue, Bronx, NY 10459",44,57,66
Middle College High School at LaGuardia Community College,"4535 VAN DAM ST, LONG ISLAND CITY NY 10451",17,29,41
MILLENNIUM ART ACADEMY,"1980 LAFAYETTE AVE, BRONX NY 10456",56,63,79
MONROE ACADEMY FOR VISUAL ARTS AND DESIGN,"1300 BOYNTON AVE, BRONX NY 11101",36,50,68
MORRIS ACADEMY FOR COLLABORATIVE STUDIES,"1100 Boston Road, Bronx, NY 10456",45,66,67
MOTT HALL BRONX HIGH SCHOOL,"1595 Bathgate Avenue, Bronx, NY 10457",55,46,64
MOTT HALL HIGH SCHOOL,"6 EDGECOMBE AVENUE, Manhattan NY 10030",31,32,39
MOTT HALL V,"1551 EAST 172ND ST, BRONX NY 10026",37,51,62
MOTT HAVEN COMMUNITY HIGH SCHOOL,"455 SOUTHERN BLVD, BRONX NY 10455",26,40,57
Mott Haven Village Preparatory High School,"701 Saint Anns Avenue, Bronx, NY 10455",39,51,61
MULTICULTURAL HIGH SCHOOL,"999 Jamaica Avenue, Brooklyn, NY 11208",50,45,39
MURRAY HILL ACADEMY,"111 EAST 33RD STREET, Manhattan NY 10016",3,19,29
NEW DAWN CHARTER HIGH SCHOOL,"242 HOYT ST, BROOKLYN NY 11217",30,19,13
NEW DESIGN HIGH SCHOOL,"350 GRAND STREET, Manhattan NY 10002",23,17,12
NEW EXPLORERS HIGH SCHOOL,"730 CONCOURSE VILLAGE WEST, Bronx NY 10451",27,42,57
NEW HEIGHTS ACADEMY CHARTER SCHOOL,"1818 Amsterdam Avenue, Manhattan 10031, Manhattan NY 10031",41,41,48
NEW UTRECHT HIGH SCHOOL,"1601 80 STREET, Brooklyn NY 11214",51,41,38
NEW VISIONS CHARTER HIGH SCHOOL FOR ADVANCED MATH and science,"99 Terrace View Ave, BRONX NY 10463",27,51,68
NEW VISIONS CHARTER HIGH SCHOOL FOR ADVANCED MATH AND SCIENCE II,"900 TINTON AVENUE, Bronx NY 10456",39,51,61
New Visions Charter High School for Advanced Math and Science III,"3000 Avenue X, Brooklyn 11235, BROOKLYN NY 11235",70,62,58
NEW VISIONS CHARTER HIGH SCHOOL FOR HUMANITIES II,"455 SOUTHERN BLVD, BRONX NY 10455",26,40,57
NEW VISIONS CHARTER HIGH SCHOOL FOR THE HUMANITIES,"99 Terrace View Ave, Bronx NY 10463",27,51,68
New Visions Charter High School for the Humanities III,"3000 Avenue X, Brooklyn 11235, BROOKLYN NY 11235",70,62,58
NEW WORLD HIGH SCHOOL,"921 East 228th Street, Bronx, NY 10466",68,77,86
NEW YORK CITY MUSEUM SCHOOL,"333 WEST 17 STREET, MANHATTAN NY 10011",15,14,21
NEWCOMERS HIGH SCHOOL,"2801 41st Avenue, Long Island City, NY 11101",15,33,42
Northside Charter High School,"424 Leonard Street, Brooklyn 11222, BROOKLYN NY 11222",25,40,32
"NYC CHARTER HS ARCHITECTURE, ENGINEERING, CONSTRUC","838 BROOK AVE, BRONX NY 10454",31,45,57
OLYMPUS ACADEMY,"755 East 100th Street, Brooklyn, NY 11236",51,58,52
ORIGINS HIGH SCHOOL,"3000 Avenue X, Brooklyn 11235, BROOKLYN NY 11235",70,62,58
Pablo Neruda Academy for Architecture and World Studies,"1980 Lafayette Avenue, Bronx, NY 10473",58,75,86
PACE HIGH SCHOOL,"100 HESTER ST, NEW YORK NY 11412",25,18,10
PAN AMERICAN INTERNATIONAL HIGH SCHOOL,"45-10 94th Street, Elmhurst, NY 11373",34,59,55
PAN AMERICAN INTERNATIONAL HIGH SCHOOL AT MONROE,"1300 Boynton Avenue, Bronx, NY 10472",36,57,67
PARK EAST HIGH SCHOOL,"23034 EAST 105TH ST, NEW YORK NY 10459",15,29,46
PARK SLOPE COLLEGIATE,"237 7th Avenue, Brooklyn, NY 11215",35,29,23
Pathways College Preparatory School: A College Board School,"10989 204TH ST, SAINT ALBANS NY 10469",60,70,85
Pathways in Technology Early College High School (P-Tech),"150 Albany Avenue, Brooklyn, NY 11213",47,32,29
PEACE AND DIVERSITY ACADEMY,"1180 Rev James A Polite Avenue, Bronx, NY 10459",44,57,66
